date,date_local,source,title,link,lang,ranking
2025-10-09 19:55:27.429266+00:00,2025-10-09 21:55:27.429266+02:00,energyconnects_europe,The next era of global energy security is fuelled by LNG flexibilityThought Leadership,https://www.energyconnects.com/opinion/thought-leadership/2025/august/lng-flexibility-is-powering-the-next-era-of-global-energy-security/,en,4
2025-10-09 19:55:27.429266+00:00,2025-10-09 21:55:27.429266+02:00,energyconnects_europe,Shaping the future of LNG and energy security at Gastech 2025 and beyondInterviews,https://www.energyconnects.com/opinion/interviews/2025/august/driving-the-lng-industry-forward-at-gastech-2025-and-beyond/,en,4
2025-10-09 19:55:27.429266+00:00,2025-10-09 21:55:27.429266+02:00,energyconnects_europe,A strategic bet on carbon capture in the face of surging energy demandsFeatures,https://www.energyconnects.com/opinion/features/2025/september/a-strategic-bet-on-carbon-capture-in-the-face-of-surging-energy-demands/,en,4
2025-10-09 19:55:27.429266+00:00,2025-10-09 21:55:27.429266+02:00,energyconnects_europe,"UK Sees Wider Power Buffer This Winter Despite Tighter Gas FlowThe UK is expected to have a bigger buffer of power generation to guard against shortages this winter, but the availability of natural gas is due to tighten.",https://www.energyconnects.com/news/utilities/2025/october/uk-sees-wider-power-buffer-this-winter-despite-tighter-gas-flow/,en,1
2025-10-09 19:55:27.429266+00:00,2025-10-09 21:55:27.429266+02:00,energyconnects_europe,German Coalition to Unite Behind Dilution of EU Combustion BanGerman Chancellor Friedrich Merz is expected to unify his ruling alliance behind his push for the European Union to dilute its 2035 ban on new combustion-engine vehicles in talks Wednesday evening.,https://www.energyconnects.com/news/renewables/2025/october/german-coalition-to-unite-behind-dilution-of-eu-combustion-ban/,en,4
2025-10-09 19:55:27.429266+00:00,2025-10-09 21:55:27.429266+02:00,energyconnects_europe,European Power Prices Turn Negative as Storm Boosts Wind OutputUtilities,https://www.energyconnects.com/news/utilities/2025/october/uk-power-slumps-below-zero-as-storm-amy-lashes-britain/,en,4
2025-10-09 19:55:27.429266+00:00,2025-10-09 21:55:27.429266+02:00,energyconnects_europe,Exxon Doubles London Energy Trading Operation With Hiring SpreeGas & LNG,https://www.energyconnects.com/news/gas-lng/2025/september/exxon-doubles-london-energy-trading-operation-with-hiring-spree/,en,4
2025-10-09 19:55:27.429266+00:00,2025-10-09 21:55:27.429266+02:00,energyconnects_gaslng,"Israel Says Gaza Ceasefire Now in Effect After Hostage DealIsrael has begun implementing a ceasefire deal in Gaza, after it reached an agreement with Hamas for the Palestinian militant group to release all the hostages it holds.",https://www.energyconnects.com/news/gas-lng/2025/october/israel-says-gaza-ceasefire-now-in-effect-after-hostage-deal/,en,4
2025-10-09 19:55:27.429266+00:00,2025-10-09 21:55:27.429266+02:00,energyconnects_gaslng,Oman Commodity Trading Firm Takes Another Shot at LNG ExpansionOman’s state-owned commodities trading firm plans to grow its liquefied natural gas business from a fraction of its portfolio to one of its biggest fuels through domestic and international deals.,https://www.energyconnects.com/news/gas-lng/2025/october/oman-commodity-trading-firm-takes-another-shot-at-lng-expansion/,en,1
2025-10-09 19:55:27.429266+00:00,2025-10-09 21:55:27.429266+02:00,energyconnects_gaslng,"Shell Signals Energy Trading Rebound in Boost for ProfitShell Plc said the performance of its oil and gas trading operation recovered in the third quarter, after struggling with geopolitical volatility in the previous period.",https://www.energyconnects.com/news/gas-lng/2025/october/shell-signals-energy-trading-rebound-in-boost-for-profit/,en,4
2025-10-09 19:55:27.429266+00:00,2025-10-09 21:55:27.429266+02:00,energyconnects_h2,OpinionHydrogen’s headline moment requires demand growth and regulatory certainty to scale,https://www.energyconnects.com/opinion/features/2025/september/hydrogen-s-headline-moment-requires-demand-growth-and-regulatory-certainty-to-scale/,en,4
2025-10-09 19:55:27.429266+00:00,2025-10-09 21:55:27.429266+02:00,energyconnects_h2,SponsoredBlue hydrogen at scale: Technip Energies' blueprint for low-carbon transformation,https://www.energyconnects.com/opinion/thought-leadership/2025/september/blue-hydrogen-at-scale-technip-energies-blueprint-for-low-carbon-transformation/,en,1
2025-10-09 19:55:27.429266+00:00,2025-10-09 21:55:27.429266+02:00,energyconnects_h2,"OpinionDriving energy security, resilience and leadership for a changing world",https://www.energyconnects.com/opinion/interviews/2025/september/driving-energy-security-resilience-and-leadership-for-a-changing-world/,en,4
2025-10-09 19:55:27.429266+00:00,2025-10-09 21:55:27.429266+02:00,energyconnects_h2,OpinionNamibia positions itself as Africa’s green hydrogen powerhouse,https://www.energyconnects.com/opinion/interviews/2025/july/namibia-positions-itself-as-africa-s-green-hydrogen-powerhouse/,en,1
2025-10-09 19:55:27.429266+00:00,2025-10-09 21:55:27.429266+02:00,energyconnects_h2,SponsoredDriving decarbonisation of the gas and hydrogen industries with scalable solutions,https://www.energyconnects.com/opinion/interviews/2025/september/driving-decarbonisation-of-the-gas-and-hydrogen-industries-with-scalable-solutions/,en,2
2025-10-09 19:55:27.429266+00:00,2025-10-09 21:55:27.429266+02:00,energyconnects_h2,OpinionGastech 2025 brings together the voices defining the energy transition,https://www.energyconnects.com/opinion/features/2025/september/gastech-2025-brings-together-the-voices-defining-the-energy-transition/,en,4
2025-10-09 19:55:27.429266+00:00,2025-10-09 21:55:27.429266+02:00,energyconnects_h2,OpinionNamibia’s green hydrogen programme: supporting the growth of a new industry,https://www.energyconnects.com/opinion/interviews/2025/september/namibia-s-green-hydrogen-programme-supporting-the-growth-of-a-new-industry/,en,1
2025-10-09 19:55:27.429266+00:00,2025-10-09 21:55:27.429266+02:00,energyconnects_h2,OpinionUnlocking capital for Africa’s green hydrogen economy,https://www.energyconnects.com/opinion/interviews/2025/september/unlocking-capital-for-africa-s-green-hydrogen-economy/,en,1
2025-10-09 19:55:27.429266+00:00,2025-10-09 21:55:27.429266+02:00,energyconnects_h2,OpinionNamibia eyes green hydrogen leadership,https://www.energyconnects.com/opinion/interviews/2025/september/namibia-eyes-green-hydrogen-leadership/,en,1
2025-10-09 19:55:27.429266+00:00,2025-10-09 21:55:27.429266+02:00,energyconnects_h2,"Trump Administration Eyes $12 Billion in New Energy Project CutsThe Trump administration is considering canceling about $12 billion in energy projects, including funding for hydrogen ventures backed by US oil majors, according to a list seen by Bloomberg.Renewables",https://www.energyconnects.com/news/renewables/2025/october/trump-administration-eyes-12-billion-in-new-energy-project-cuts/,en,4
2025-10-09 19:55:27.429266+00:00,2025-10-09 21:55:27.429266+02:00,energyconnects_h2,"NewsWoodside, JSE, KEPCO partner to build Australia–Japan liquid hydrogen supply chain",https://www.energyconnects.com/news/gas-lng/2025/september/woodside-jse-kepco-partner-to-build-australia-japan-liquid-hydrogen-supply-chain/,en,1
2025-10-09 19:55:27.429266+00:00,2025-10-09 21:55:27.429266+02:00,energyconnects_h2,NewsVenture Capitalists Band Together in New Bid to Back Climate Tech,https://www.energyconnects.com/news/renewables/2025/september/venture-capitalists-band-together-in-new-bid-to-back-climate-tech/,en,5
2025-10-09 19:55:27.429266+00:00,2025-10-09 21:55:27.429266+02:00,energyconnects_ren,"Microsoft Vies for Scarce Clean Power in Asia Chipmaking NationsMicrosoft Corp. warned that it is competing for limited supplies of clean electricity in parts of East Asia, even as its window to achieve a key 2030 climate target narrows.",https://www.energyconnects.com/news/renewables/2025/october/microsoft-vies-for-scarce-clean-power-in-asia-chipmaking-nations/,en,4
2025-10-09 19:55:27.429266+00:00,2025-10-09 21:55:27.429266+02:00,energyconnects_ren,Generate Capital Cuts Staff Amid Downturn in Climate FinanceThe challenge comes as President Donald Trump dismantles policies that support renewable energy.,https://www.energyconnects.com/news/renewables/2025/october/generate-capital-cuts-staff-amid-downturn-in-climate-finance/,en,4
2025-10-09 00:27:57+00:00,2025-10-09 02:27:57+02:00,elespanol_energy_news,El sector energético clama contra Red Eléctrica por sembrar dudas sobre el sistema tras alertar de un nuevo apagón,https://www.elespanol.com/invertia/empresas/energia/20251009/sector-energetico-clama-red-electrica-sembrar-dudas-sistema-alertar-nuevo-apagon/1003743961292_0.html,es,2
2025-10-09 08:30:05+00:00,2025-10-09 10:30:05+02:00,elespanol_energy_news,"El Gobierno publica el Plan de la red de transporte eléctrica para audiencia, tras una semana con ""problemas informáticos""",https://www.elespanol.com/invertia/empresas/energia/20251009/gobierno-publica-plan-red-transporte-electrica-audiencia-semana-problemas-informaticos/1003743961613_0.html,es,2
2025-10-08 00:07:46+00:00,2025-10-08 02:07:46+02:00,elespanol_energy_news,"El Gobierno francés, ante el récord histórico de deuda pública, valora la venta de su participación en Engie",https://www.elespanol.com/invertia/empresas/energia/20251008/gobierno-frances-record-historico-deuda-publica-valora-venta-participacion-engie/1003743959163_0.html,es,5
2025-10-08 16:03:13+00:00,2025-10-08 18:03:13+02:00,elespanol_energy_news,La gran industria reclama priorizar sus proyectos en la conexión de nueva capacidad a la red eléctrica,https://www.elespanol.com/invertia/empresas/energia/20251008/gran-industria-reclama-priorizar-proyectos-conexion-nueva-capacidad-red-electrica/1003743960980_0.html,es,2
2025-10-09 00:26:37+00:00,2025-10-09 02:26:37+02:00,elespanol_energy_news,El Supremo de EEUU llama a pronunciarse al Gobierno de Trump en la batalla de España por los laudos renovables,https://www.elespanol.com/invertia/empresas/energia/20251009/supremo-eeuu-llama-pronunciarse-gobierno-trump-batalla-espana-laudos-renovables/1003743960845_0.html,es,3
2025-10-08 12:18:29+00:00,2025-10-08 14:18:29+02:00,elespanol_energy_news,El borrador de Autoconsumo del Gobierno obligará a llevar un registro administrativo de las instalaciones existentes,https://www.elespanol.com/invertia/empresas/energia/20251008/borrador-autoconsumo-gobierno-obligara-llevar-registro-administrativo-instalaciones-existentes/1003743960377_0.html,es,5
2025-10-08 16:18:04+00:00,2025-10-08 18:18:04+02:00,elespanol_energy_news,"Repsol produce, por primera vez a escala industrial, gasolina 100% renovable en su centro de Tarragona",https://www.elespanol.com/invertia/empresas/energia/20251008/repsol-produce-primera-vez-escala-industrial-gasolina-renovable-centro-tarragona/1003743961005_0.html,es,5
2025-10-07 12:58:20+00:00,2025-10-07 14:58:20+02:00,elespanol_energy_news,"La fotovoltaica, preocupada por los vertidos y las horas cero: ""hay nudos en el sur que tiran hasta el 50% de la generación solar""",https://www.elespanol.com/invertia/empresas/energia/20251007/fotovoltaica-preocupada-vertidos-horas-cero-nudos-sur-tiran-generacion-solar/1003743958572_0.html,es,4
2025-10-08 17:44:05+00:00,2025-10-08 19:44:05+02:00,elespanol_energy_news,REE pide a la CNMC cambios urgentes en la operación del sistema ante el riesgo de un nuevo apagón,https://www.elespanol.com/invertia/empresas/energia/20251008/cnmc-somete-audiencia-publica-modificacion-varios-procedimientos-sistema-electrico/1003743961164_0.html,es,5
2025-10-08 00:07:44+00:00,2025-10-08 02:07:44+02:00,elespanol_energy_news,La opacidad de Red Eléctrica en su operativa tras el apagón agrava la crisis de confianza con el sector energético,https://www.elespanol.com/invertia/empresas/energia/20251008/opacidad-red-electrica-operativa-apagon-agrava-crisis-confianza-sector-energetico/1003743959160_0.html,es,2
2025-10-07 00:11:26+00:00,2025-10-07 02:11:26+02:00,elespanol_energy_news,La luz vuelve a subir: la factura cambia y su precio ya se rige por un sistema cuartohorario,https://www.elespanol.com/invertia/empresas/energia/20251007/luz-vuelve-subir-factura-cambia-precio-rige-sistema-cuartohorario/1003743957348_0.html,es,5
2025-10-09 19:02:17+00:00,2025-10-09 21:02:17+02:00,elespanol_energy_news,"Moeve, pionera en el suministro de diésel renovable dentro de un aeropuerto español, en El Prat de Barcelona",https://www.elespanol.com/invertia/empresas/energia/20251009/moeve-pionera-suministro-diesel-renovable-dentro-aeropuerto-espanol-prat-barcelona/1003743963053_0.html,es,5
2025-10-09 18:57:05+00:00,2025-10-09 20:57:05+02:00,elespanol_energy_news,Repsol mantiene su producción en el tercer trimestre y más que duplica su margen de refino,https://www.elespanol.com/invertia/empresas/energia/20251009/repsol-mantiene-produccion-tercer-trimestre-duplica-margen-refino/1003743963044_0.html,es,5
2025-10-09 17:00:01+00:00,2025-10-09 19:00:01+02:00,energiaoltre_news,Ok alla legge umbra sull'Energia. CER e meno burocrazia nelle aree idonee,https://energiaoltre.it/umbra-energia-cer-aree-idonee/,it,5
2025-10-09 15:07:34+00:00,2025-10-09 17:07:34+02:00,energiaoltre_news,"Timori cinesi scaldano la Germania, Berlino frena sull'operazione Open Grid Europe-Snam",https://energiaoltre.it/timori-cinesi-scaldano-la-germania-berlino-frena-sulloperazione-open-grid-europe-snam/,it,5
2025-10-09 14:28:25+00:00,2025-10-09 16:28:25+02:00,energiaoltre_news,"Il Governo stoppa le voci sull'ex Ilva: ""No allo spezzatino, il governo lavora a un progetto unitario""",https://energiaoltre.it/urso-stoppa-le-voci-sullex-ilva-no-allo-spezzatino-il-governo-lavora-a-un-progetto-unitario/,it,5
2025-10-09 15:15:10+00:00,2025-10-09 17:15:10+02:00,energiaoltre_news,"Urso canta vittoria sull’auto: “Grazie all’Italia, l’Europa rivedrà le follie del Green Deal”",https://energiaoltre.it/urso-canta-vittoria-sullauto-grazie-allitalia-leuropa-rivedra-le-follie-del-green-deal/,it,4
2025-10-09 15:09:51+00:00,2025-10-09 17:09:51+02:00,energiaoltre_news,Perché Filosa fa piazza pulita dei vertici di Stellantis?,https://energiaoltre.it/filosa-stellantis-vertici/,it,5
2025-10-09 10:32:32+00:00,2025-10-09 12:32:32+02:00,energiaoltre_news,"Global Gateway, l’Europa batte la Cina: 306 miliardi già mobilitati, obiettivo superato",https://energiaoltre.it/global-gateway-leuropa-batte-la-cina-306-miliardi-gia-mobilitati-obiettivo-superato/,it,5
2025-10-09 09:50:06+00:00,2025-10-09 11:50:06+02:00,energiaoltre_news,"Allarme della Corte dei Conti europea su Fondi Ue: spesa fuori controllo, a rischio PNRR e Green Deal",https://energiaoltre.it/allarme-della-corte-dei-conti-europea-su-fondi-ue-spesa-fuori-controllo-a-rischio-pnrr-e-green-deal/,it,4
2025-10-09 09:38:06+00:00,2025-10-09 11:38:06+02:00,energiaoltre_news,Otto progetti per Taranto. Ma resta il nodo ex Ilva e l’attrattività degli investimenti,https://energiaoltre.it/otto-progetti-per-taranto-ma-resta-il-nodo-ex-ilva-e-lattrattivita-degli-investimenti/,it,5
2025-10-09 06:31:35+00:00,2025-10-09 08:31:35+02:00,energiaoltre_news,L’eolico offshore continua a crescere (e l’Italia farà la sua parte),https://energiaoltre.it/leolico-offshore-continua-a-crescere-e-litalia-fara-la-sua-parte/,it,3
2025-10-08 16:35:05+00:00,2025-10-08 18:35:05+02:00,energiaoltre_news,"Acea, colpo di scena sulla rete gas: la multiutility si sfila dalla gara per gli asset Italgas",https://energiaoltre.it/acea-colpo-di-scena-sulla-rete-gas-la-multiutility-si-sfila-dalla-gara-per-gli-asset-italgas/,it,2
2025-10-08 15:43:33+00:00,2025-10-08 17:43:33+02:00,energiaoltre_news,Antitrust: “Margini gonfiati e prezzi allineati dal cartello del biocarburante. Eni regista”.,https://energiaoltre.it/antitrust-margini-gonfiati-e-prezzi-allineati-dal-cartello-del-biocarburante-eni-regista/,it,5
2025-10-08 13:40:45+00:00,2025-10-08 15:40:45+02:00,energiaoltre_news,"Derivati su luce e gas, rivoluzione del Governo: più poteri a Consob, meno burocrazia",https://energiaoltre.it/derivati-su-luce-e-gas-rivoluzione-del-governo-piu-poteri-a-consob-meno-burocrazia/,it,1
2025-10-08 10:39:53+00:00,2025-10-08 12:39:53+02:00,energiaoltre_news,"PNRR, l’Italia promossa da Bruxelles: erogato oltre il 65% dei fondi, RFI primo beneficiario",https://energiaoltre.it/pnrr-litalia-promossa-da-bruxelles-erogato-oltre-il-65-dei-fondi-rfi-primo-beneficiario-3/,it,2
2025-10-07 09:15:04+00:00,2025-10-07 11:15:04+02:00,energiaoltre_news,“Teniamo le centrali a carbone”: la mossa a sorpresa di Pichetto per la sicurezza nazionale,https://energiaoltre.it/teniamo-le-centrali-a-carbone-la-mossa-a-sorpresa-di-pichetto-per-la-sicurezza-nazionale/,it,5
2025-10-08 10:06:18+00:00,2025-10-08 12:06:18+02:00,energiaoltre_news,Le supercar di Porsche accelerano verso la sostenibilità con i volanti riciclati,https://energiaoltre.it/porsche-rifiuti-basf/,it,5
2025-10-07 14:34:48+00:00,2025-10-07 16:34:48+02:00,energiaoltre_news,“L’Energia Interconnessa” per vincere le sfide della transizione. Il Green & Net Zero Talk,https://energiaoltre.it/green-net-transizione-energia/,it,4
2025-10-07 14:00:21+00:00,2025-10-07 16:00:21+02:00,energiaoltre_news,Riciclo da record. L’Italia raddoppia la media UE e spinge sull’economia circolare,https://energiaoltre.it/riciclo-record/,it,2
2025-10-09 19:55:27.429266+00:00,2025-10-09 21:55:27.429266+02:00,energy_ec_eu_news,5 things you should know about biogas and biomethane,https://energy.ec.europa.eu/news/5-things-you-should-know-about-biogas-and-biomethane-2025-10-09_en,en,1
2025-10-09 19:55:27.429266+00:00,2025-10-09 21:55:27.429266+02:00,energy_ec_eu_news,"The EU is prepared for winter and beyond, confirms the latest report of European transmission system operators for gas",https://energy.ec.europa.eu/news/eu-prepared-winter-and-beyond-confirms-latest-report-european-transmission-system-operators-gas-2025-10-09_en,en,1
2025-10-09 19:55:27.429266+00:00,2025-10-09 21:55:27.429266+02:00,energy_ec_eu_news,Calculating the global warming potential of new buildings: Open for public feedback,https://energy.ec.europa.eu/news/calculating-global-warming-potential-new-buildings-open-public-feedback-2025-10-06_en,en,5
2025-10-09 19:55:27.429266+00:00,2025-10-09 21:55:27.429266+02:00,energy_ec_eu_news,Call for evidence: EU energy security framework (revision),https://ec.europa.eu/info/law/better-regulation/have-your-say/initiatives/14695-EU-energy-security-framework-revision-_en,en,4
2025-10-09 19:55:27.429266+00:00,2025-10-09 21:55:27.429266+02:00,energy_ec_eu_news,Public consultation on how to increase lending for the energy renovation of buildings,https://ec.europa.eu/info/law/better-regulation/have-your-say/initiatives/14396-Energy-efficient-buildings-portfolio-framework-to-increase-lending-for-renovations-delegated-act-/public-consultation_en,en,4
2025-10-09 19:55:27.429266+00:00,2025-10-09 21:55:27.429266+02:00,energy_ec_eu_news,Artificial intelligence and digitalisation for energy – a roadmap,https://ec.europa.eu/info/law/better-regulation/have-your-say/initiatives/14742-Artificial-intelligence-and-digitalisation-for-energy-a-roadmap_en,en,4
2025-10-09 19:55:27.429266+00:00,2025-10-09 21:55:27.429266+02:00,energy_ec_eu_news,Energy efficiency awareness,https://energy.ec.europa.eu/topics/energy-efficiency/new-impetus-energy-efficiency/energy-efficiency-awareness_en,en,4
2025-10-09 19:55:27.429266+00:00,2025-10-09 21:55:27.429266+02:00,energy_ec_eu_news,REPowerEU - 3 years on,https://energy.ec.europa.eu/topics/markets-and-consumers/actions-and-measures-energy-prices/repowereu-3-years_en,en,5
2025-10-09 19:55:27.429266+00:00,2025-10-09 21:55:27.429266+02:00,energy_ec_eu_news,Energy label and ecodesign,https://commission.europa.eu/energy-climate-change-environment/standards-tools-and-labels/products-labelling-rules-and-requirements/energy-label-and-ecodesign_en,en,4
2025-10-09 19:55:27.429266+00:00,2025-10-09 21:55:27.429266+02:00,energy_ec_eu_news,Implementation dialogue on energy efficient product legislation with Commissioner Dan Jørgensen,https://energy.ec.europa.eu/events/implementation-dialogue-energy-efficient-product-legislation-commissioner-dan-jorgensen-2025-10-14_en,en,4
2025-10-16 08:00:00+00:00,2025-10-16 10:00:00+02:00,energy_ec_eu_news,EU Covenant of Mayors Ceremony 2025,https://eu-mayors.ec.europa.eu/en/Covenant-Ceremony-2025,en,5
2025-10-09 19:55:27.429266+00:00,2025-10-09 21:55:27.429266+02:00,energy_ec_eu_news,Smart Readiness Indicator 4th joint event,https://energy.ec.europa.eu/events/smart-readiness-indicator-4th-joint-event-2025-10-22_en,en,5
2025-10-09 19:55:27.429266+00:00,2025-10-09 21:55:27.429266+02:00,energy_ec_eu_news,Power of participation - advancing public engagement in grid planning,https://energy.ec.europa.eu/events/power-participation-advancing-public-engagement-grid-planning-2025-10-23_en,en,4
2025-10-09 19:55:27.429266+00:00,2025-10-09 21:55:27.429266+02:00,cinea_news,Citizens embrace energy projects: European Energy Communities Facility surpasses expectations,https://cinea.ec.europa.eu/news-events/news/citizens-embrace-energy-projects-european-energy-communities-facility-surpasses-expectations-2025-10-09_en,en,4
2025-10-09 19:55:27.429266+00:00,2025-10-09 21:55:27.429266+02:00,cinea_news,CINEA’s Hydrogen Week,https://cinea.ec.europa.eu/news-events/news/cineas-hydrogen-week-2025-10-09_en,de,1
2025-10-09 19:55:27.429266+00:00,2025-10-09 21:55:27.429266+02:00,cinea_news,Urban Mobility Days 2025: driving forward the urban mobility transformation,https://cinea.ec.europa.eu/news-events/news/urban-mobility-days-2025-driving-forward-urban-mobility-transformation-2025-10-08_en,en,5
2025-10-09 19:55:27.429266+00:00,2025-10-09 21:55:27.429266+02:00,cinea_news,CEF Energy: Celtic Interconnector reaches major milestone with start of marine cable laying,https://cinea.ec.europa.eu/news-events/news/cef-energy-celtic-interconnector-reaches-major-milestone-start-marine-cable-laying-2025-10-07_en,en,4
2025-10-09 19:55:27.429266+00:00,2025-10-09 21:55:27.429266+02:00,cinea_news,Step-WISE adopter workshops,https://cinea.ec.europa.eu/news-events/events/step-wise-adopter-workshops-2025-09-10_en,en,5
2025-10-09 19:55:27.429266+00:00,2025-10-09 21:55:27.429266+02:00,cinea_news,LIFE at EUROPARC Conference 2025,https://cinea.ec.europa.eu/news-events/events/life-europarc-conference-2025-2025-10-07_en,en,5
2025-10-09 19:55:27.429266+00:00,2025-10-09 21:55:27.429266+02:00,cinea_news,LIFE at Pollutec 2025,https://cinea.ec.europa.eu/news-events/events/life-pollutec-2025-2025-10-07_en,en,5
2025-10-09 19:55:27.429266+00:00,2025-10-09 21:55:27.429266+02:00,cinea_news,BOG4LIFE International Symposium – Peatland Perspectives: restoring for tomorrow,https://cinea.ec.europa.eu/news-events/events/bog4life-international-symposium-peatland-perspectives-restoring-tomorrow-2025-10-08_en,en,5
2025-10-09 19:55:27.429266+00:00,2025-10-10 00:00:00+02:00,eu_consilium_energy,CM 4516 2025 INIT,https://data.consilium.europa.eu/doc/document/CM-4516-2025-INIT/en/pdf,en,5
2025-10-09 19:55:27.429266+00:00,2025-10-09 20:33:23+02:00,staffettaquotidiana,Italgas cede 247mila pdr per 253 milioni,https://www.staffettaonline.com/articolo.aspx?id=398899,it,5
2025-10-09 19:55:27.429266+00:00,2025-10-09 20:18:02+02:00,Jornal Económico,"OE2026: CIP considera preocupante o aumento da despesa em 4,5% e a erosão do salário líquido",https://jornaleconomico.sapo.pt/noticias/cip-considera-preocupante-o-aumento-da-despesa-em-45-e-a-erosao-do-salario-liquido/,es,5
2025-10-09 19:55:27.429266+00:00,2025-10-09 19:37:28+02:00,Jornal Económico,ACP critica falta de programa de abate de veículos no OE26,https://jornaleconomico.sapo.pt/noticias/acp-critica-falta-de-programa-de-abate-de-veiculos-no-oe26/,es,5
2025-10-09 19:55:27.429266+00:00,2025-10-09 19:11:18+02:00,Jornal Económico,PAN considera “absurdo” que Orçamento seja entregue em plena campanha eleitoral,https://jornaleconomico.sapo.pt/noticias/pan-considera-absurdo-que-orcamento-seja-entregue-em-plena-campanha-eleitoral/,es,5
2025-10-09 19:55:27.429266+00:00,2025-10-09 18:56:52+02:00,Jornal Económico,OE2026: Livre acusa Montenegro de ter gasto excedente orçamental em campanha eleitoral,https://jornaleconomico.sapo.pt/noticias/oe2026-livre-acusa-montenegro-de-ter-gasto-excedente-orcamental-em-campanha-eleitoral/,es,5
2025-10-09 19:55:27.429266+00:00,2025-10-09 18:49:10+02:00,staffettaquotidiana,Acea non corre per gli asset Italgas,https://www.staffettaonline.com/articolo.aspx?id=398898,it,5
2025-10-09 19:55:27.429266+00:00,2025-10-09 18:47:07+02:00,Jornal Económico,OE2026: IL preocupada com preço das casas e despesa do Estado,https://jornaleconomico.sapo.pt/noticias/oe2026-il-preocupada-com-precos-das-casas-e-despesa-do-estado/,es,5
2025-10-09 19:55:27.429266+00:00,2025-10-09 18:46:29+02:00,Jornal Económico,OE2026: Carneiro diz que Governo cumpriu exigências do PS e abre porta à viabilização,https://jornaleconomico.sapo.pt/noticias/oe2026-carneiro-diz-que-governo-cumpriu-exigencias-do-ps-e-abre-porta-a-viabilizacao/,es,5
2025-10-09 19:55:27.429266+00:00,2025-10-09 18:44:27+02:00,Jornal Económico,"“Chega não tolerará na Assembleia da República nenhum aumento sobre os combustíveis”, diz Ventura",https://jornaleconomico.sapo.pt/noticias/chega-nao-tolerara-na-assembleia-da-republica-nenhum-aumento-sobre-os-combustiveis-diz-ventura/,es,5
2025-10-09 19:55:27.429266+00:00,2025-10-09 18:38:08+02:00,Jornal Económico,Martifer sob cancela assembleia e já não vai distribuir 4 milhões de euros de reservas,https://jornaleconomico.sapo.pt/noticias/martifer-sob-cancela-assembleia-e-ja-nao-vai-distribuir-4-milhoes-de-euros-de-reservas/,es,5
