date,date_local,source,title,link,lang,ranking
2025-10-09 19:55:27.429266+00:00,2025-10-03 07:00:18+02:00,Biofuels International,LanzaJet and KMG sign first SAF project in Kazakhstan,https://biofuels-news.com/news/lanzajet-and-kmg-sign-first-saf-project-in-kazakhstan/,en,3
2025-10-09 19:55:27.429266+00:00,2025-10-03 02:00:00+02:00,iaea,Update 318 – IAEA Director General Statement on Situation in Ukraine,http://www.iaea.org/newscenter/pressreleases/update-318-iaea-director-general-statement-on-situation-in-ukraine,en,5
2025-10-09 19:55:27.429266+00:00,2025-10-02 20:22:28+02:00,nouvelobs_economie,Grève du 2 octobre : revivez les moments forts de cette journée de mobilisation,https://www.nouvelobs.com/social/20251002.OBS108288/en-direct-greve-du-2-octobre-suivez-la-journee-de-mobilisation-en-direct.html,fr,5
2025-10-09 19:55:27.429266+00:00,2025-10-02 19:31:14+02:00,nouvelobs_economie,"Grève du 2 octobre : face au budget de Lecornu, une troisième mobilisation moindre mais avec « la même colère »",https://www.nouvelobs.com/social/20251002.OBS108317/greve-du-2-octobre-face-au-budget-de-lecornu-une-troisieme-mobilisation-moindre-avec-la-meme-colere.html,fr,5
2025-10-09 19:55:27.429266+00:00,2025-10-02 17:42:41+02:00,MIMIT,"Portovesme: Mimit, Regione Sardegna collabori con governo per futuro dell'area",https://www.mimit.gov.it/it/notizie-stampa/portovesme-mimit-regione-sardegna-collabori-con-governo-per-futuro-dellarea,it,5
2025-10-09 19:55:27.429266+00:00,2025-10-02 17:34:27+02:00,nouvelobs_economie,Baisse de prélèvements et de l’impôt sur le revenu… Ce qu’il faut retenir des annonces de Lecornu,https://www.nouvelobs.com/politique/20251002.OBS108308/baisses-de-prelevements-et-de-l-impot-sur-le-revenu-ce-qu-il-faut-retenir-des-annonces-de-lecornu.html,fr,5
2025-10-09 19:55:27.429266+00:00,2025-10-02 16:00:18+02:00,nouvelobs_economie,Shein au BHV et aux Galeries Lafayette : « Ils cherchent à se racheter une respectabilité en France »,https://www.nouvelobs.com/economie/20251002.OBS108304/shein-au-bhv-et-aux-galeries-lafayette-ils-cherchent-a-se-racheter-une-respectabilite-en-france.html,fr,5
2025-10-09 19:55:27.429266+00:00,2025-10-02 15:39:34+02:00,Energy_EU,Commission's assessment of Estonia and Slovakia National Energy and Climate Plans shows improvements on ambition closing in  on 2030 targets but more efforts needed,https://energy.ec.europa.eu/news/commissions-assessment-estonia-and-slovakia-national-energy-and-climate-plans-shows-improvements-2025-10-02_en,en,4
2025-10-09 19:55:27.429266+00:00,2025-10-02 15:37:10+02:00,SAMRD,Strom- und Gaspreisindizes im Oktober,https://www.smard.de/home/strom-und-gaspreisindizes-im-oktober-217918,de,5
2025-10-09 19:55:27.429266+00:00,2025-10-02 15:31:23+02:00,Energy_Storage,SPP utility to invest over US$600 million in 1.9GWh BESS projects to address ‘significant capacity deficit’,https://www.energy-storage.news/spp-utility-to-invest-over-us600-million-in-1-9gwh-bess-projects-to-address-significant-capacity-deficit/,en,2
2025-10-09 19:55:27.429266+00:00,2025-10-02 14:41:38+02:00,Energy_Storage,"US utility Duke Energy files Carolinas Resource Plan, including 5.6GWh of energy storage",https://www.energy-storage.news/us-utility-duke-energy-files-carolinas-resource-plan-including-5-6gwh-of-energy-storage/,en,4
